{
  "claimBoundary": {
    "experiment": "postOutcomeExploratoryInstrumentationReplay",
    "h6": "readOnlyImmutableHistoricalEvidence",
    "interpretation": "descriptiveOnlyNotConfirmatoryNotCausal",
    "policySelection": "unchangedB1C1NoRelaxationNoReranking"
  },
  "design": {
    "armIds": [
      "b1",
      "c1"
    ],
    "evidenceProfile": "retained-portfolio-v1",
    "failureTreatment": "retainTypedFailureNoRetryNoReplacement",
    "masterSeed": 7,
    "pairedTargetCount": 40,
    "panelIds": [
      "A",
      "B"
    ],
    "plannedArmRunCount": 80,
    "requestCountPerRun": 108,
    "solverSeedsAreReplicates": false
  },
  "execution": {
    "forbiddenRoots": [
      "E:\\RideBoundData\\wp9\\confirmatory-h6-panela",
      "E:\\RideBoundData\\wp9\\confirmatory-h6-panelb"
    ],
    "maximumInputLineBytes": 67108864,
    "maximumOutputLineBytes": 67108864,
    "maximumParallelJobs": 4,
    "maximumRunnerStderrBytes": 1048576,
    "outputRoots": {
      "A": "E:\\RideBoundData\\wp13\\e1-retained-portfolio-panel-a",
      "B": "E:\\RideBoundData\\wp13\\e1-retained-portfolio-panel-b"
    },
    "repeatsPerArm": 1,
    "runnerTimeoutSeconds": 60
  },
  "freezeId": "wp13-e1-retained-portfolio-replay-v1",
  "frozenAtUtc": "2026-08-24T04:37:02.2036172Z",
  "repositoryFiles": [
    {
      "lengthBytes": 838,
      "path": "benchmarks/configurations/wp13-e1-fleetpy-ridebound-hard-vector-retained-v1.json",
      "sha256": "b12f72dfddb3682d008c663911c47390d2f74674c800f78ba7c9f334533b1c33"
    },
    {
      "lengthBytes": 829,
      "path": "benchmarks/configurations/wp13-e1-fleetpy-rolling-cost-retained-v1.json",
      "sha256": "7202caf148b8740f6873bc536ac2cb63bd44969c04259149adb44bf448e92807"
    },
    {
      "lengthBytes": 2377,
      "path": "benchmarks/configurations/wp8-drop-eta-budget-tight-v1.json",
      "sha256": "d6124f3f964d8385db381d53b75c142cf2ac870b22823d6675325c3808808beb"
    },
    {
      "lengthBytes": 777,
      "path": "benchmarks/configurations/wp9-fleetpy-ridebound-hard-vector-audited-v1.json",
      "sha256": "abfd1c608e3c0e4324fcc7cdc0feb7095de37057a135088162f7788a9c96ee2f"
    },
    {
      "lengthBytes": 768,
      "path": "benchmarks/configurations/wp9-fleetpy-rolling-cost-audited-v1.json",
      "sha256": "60d1e7197672d41299e5d35281bf5f42506687df230f0e852083c86570c35c85"
    },
    {
      "lengthBytes": 30078,
      "path": "benchmarks/scenarios/wp13-e1/execution-plan-panel-a-v1.json",
      "sha256": "9dabc5b89cf45b2b5d75cc22c2e406648129bc187242ef26dba82ed9bb34ebfe"
    },
    {
      "lengthBytes": 30518,
      "path": "benchmarks/scenarios/wp13-e1/execution-plan-panel-b-v1.json",
      "sha256": "3e2326794d4d7c64fa455eeb73830099749572f12726ecfd345499f0b0558fca"
    },
    {
      "lengthBytes": 1287,
      "path": "benchmarks/scenarios/wp9-confirmatory/d20181114-s10-r1.driver.json",
      "sha256": "072227671e38a398f72b29bfaba493d2618e71c270789876bd87b451ca1a8ea6"
    },
    {
      "lengthBytes": 1324,
      "path": "benchmarks/scenarios/wp9-confirmatory/d20181114-s10-r1.veh4.driver.json",
      "sha256": "03a88dd891f397bf994cb87e735939e8f206216289591d5724212cf268552b51"
    },
    {
      "lengthBytes": 1287,
      "path": "benchmarks/scenarios/wp9-confirmatory/d20181114-s10-r2.driver.json",
      "sha256": "ceaff53fa2a231c8f56b650a2e99befec116b52db7a8c5e99ff33035ef648d58"
    },
    {
      "lengthBytes": 1324,
      "path": "benchmarks/scenarios/wp9-confirmatory/d20181114-s10-r2.veh4.driver.json",
      "sha256": "53924d73bee24472e640e6b10e6999b3fe8f4b0c3af5a375d9ceda535fdeec0c"
    },
    {
      "lengthBytes": 1287,
      "path": "benchmarks/scenarios/wp9-confirmatory/d20181114-s10-r3.driver.json",
      "sha256": "2dcbc74784099bb5e05815b81e65b2c9d0b01a934a44a0a7148dfee4176453b6"
    },
    {
      "lengthBytes": 1324,
      "path": "benchmarks/scenarios/wp9-confirmatory/d20181114-s10-r3.veh4.driver.json",
      "sha256": "cea6d57d494da2470816e7782fc13e84822394e8848e35dd488fc28940612d64"
    },
    {
      "lengthBytes": 1287,
      "path": "benchmarks/scenarios/wp9-confirmatory/d20181114-s10-r4.driver.json",
      "sha256": "203d1a1a22e589a5e0d6f17119865767c73998f73e456c5d2cb340d66907ad34"
    },
    {
      "lengthBytes": 1324,
      "path": "benchmarks/scenarios/wp9-confirmatory/d20181114-s10-r4.veh4.driver.json",
      "sha256": "09702881fac073ca74e7299bc0a1886b38a66cf291c39e549b471a2bde8cb2c3"
    },
    {
      "lengthBytes": 1287,
      "path": "benchmarks/scenarios/wp9-confirmatory/d20181115-s10-r1.driver.json",
      "sha256": "751178c991c178d286af061e810d0bb17b12c5f3dc3a1074cb9dee52318b320d"
    },
    {
      "lengthBytes": 1324,
      "path": "benchmarks/scenarios/wp9-confirmatory/d20181115-s10-r1.veh4.driver.json",
      "sha256": "7e8ab7d7f7fe58f2423ab488622e556fd00685fbb6dcd0cf10c3757dbfa65574"
    },
    {
      "lengthBytes": 1287,
      "path": "benchmarks/scenarios/wp9-confirmatory/d20181115-s10-r2.driver.json",
      "sha256": "a0fddb2b382248035ce5250ee0148fb4a31a4337963fcc82d887681dc6eb51ec"
    },
    {
      "lengthBytes": 1324,
      "path": "benchmarks/scenarios/wp9-confirmatory/d20181115-s10-r2.veh4.driver.json",
      "sha256": "77a3a594ec0a6563d6a8f6ef78607f749790791281b8bf7163a3a5e9ce542a0f"
    },
    {
      "lengthBytes": 1287,
      "path": "benchmarks/scenarios/wp9-confirmatory/d20181115-s10-r3.driver.json",
      "sha256": "4a5bdcf487b27660ffddea6f237181eb69d8fb4bfaa3d76a4c808c27ea782e5a"
    },
    {
      "lengthBytes": 1324,
      "path": "benchmarks/scenarios/wp9-confirmatory/d20181115-s10-r3.veh4.driver.json",
      "sha256": "d747dc7059a49950ffb828cf5b9f507b7271610673ec4ca2cab6fa04d0638964"
    },
    {
      "lengthBytes": 1287,
      "path": "benchmarks/scenarios/wp9-confirmatory/d20181115-s10-r4.driver.json",
      "sha256": "4911c63dd462cd6e2b408cbb0d91460224036ffccfea9f9d4b07a08aef7ec9fc"
    },
    {
      "lengthBytes": 1324,
      "path": "benchmarks/scenarios/wp9-confirmatory/d20181115-s10-r4.veh4.driver.json",
      "sha256": "65563c3d9d5d47a667e15adbe0aafcd3df7b1db3cffe6f632eefeb11268e0155"
    },
    {
      "lengthBytes": 1287,
      "path": "benchmarks/scenarios/wp9-confirmatory/d20181116-s10-r1.driver.json",
      "sha256": "8442007068c52afaa036a335fc1fc864a0bf7d98bb0d11e12152f5d204cf7796"
    },
    {
      "lengthBytes": 1324,
      "path": "benchmarks/scenarios/wp9-confirmatory/d20181116-s10-r1.veh4.driver.json",
      "sha256": "272a64a6733a41f2fa2fc89b71d0e6d6db39e2cee8ed6ced51f944fd057b50ec"
    },
    {
      "lengthBytes": 1287,
      "path": "benchmarks/scenarios/wp9-confirmatory/d20181116-s10-r2.driver.json",
      "sha256": "4175dd19f930baa6e2b320e5893e9dc040fad8849a31ffc618532e64a6537ab5"
    },
    {
      "lengthBytes": 1324,
      "path": "benchmarks/scenarios/wp9-confirmatory/d20181116-s10-r2.veh4.driver.json",
      "sha256": "0e39c39b226c36fc5659b8ade7ac97d8e4ad9e5aa296e15b71159ee3e8ff8e44"
    },
    {
      "lengthBytes": 1287,
      "path": "benchmarks/scenarios/wp9-confirmatory/d20181116-s10-r3.driver.json",
      "sha256": "7197733b1ebfac0335f74d3abee582bbc7df5d2e4f1c76090733012dd4b24de1"
    },
    {
      "lengthBytes": 1324,
      "path": "benchmarks/scenarios/wp9-confirmatory/d20181116-s10-r3.veh4.driver.json",
      "sha256": "e8bc5551af88a4a91df363cf7d68fafc54a8f4641602183da94d0f2fc3d10a75"
    },
    {
      "lengthBytes": 1287,
      "path": "benchmarks/scenarios/wp9-confirmatory/d20181116-s10-r4.driver.json",
      "sha256": "1ea5ee25d8dcefd101004de0fe4b213f7ac0291f912be601933a3e37d657e5b2"
    },
    {
      "lengthBytes": 1324,
      "path": "benchmarks/scenarios/wp9-confirmatory/d20181116-s10-r4.veh4.driver.json",
      "sha256": "cf2471089a6a58e18c87a52b61afa2b4fd20821786d9014db99d004247aca2a0"
    },
    {
      "lengthBytes": 1287,
      "path": "benchmarks/scenarios/wp9-confirmatory/d20181117-s10-r1.driver.json",
      "sha256": "92ccf719bbe03f35afb26948a4800e3000ee0577d0a3ffdcab95387d3e2b238e"
    },
    {
      "lengthBytes": 1324,
      "path": "benchmarks/scenarios/wp9-confirmatory/d20181117-s10-r1.veh4.driver.json",
      "sha256": "bfb0d3a4c357033a9d47e49c3d1fcb5333c65d41cc491e658fc6285050dd1696"
    },
    {
      "lengthBytes": 1287,
      "path": "benchmarks/scenarios/wp9-confirmatory/d20181117-s10-r2.driver.json",
      "sha256": "8bb01ea6540710c46bb9822c1dbefdee95a2dc87396e42f65207d5cefba5b613"
    },
    {
      "lengthBytes": 1324,
      "path": "benchmarks/scenarios/wp9-confirmatory/d20181117-s10-r2.veh4.driver.json",
      "sha256": "e074614afe0c3ada1794cf41a34dc0f73ddf94993bd5a2e5a19cb74e60882af0"
    },
    {
      "lengthBytes": 1287,
      "path": "benchmarks/scenarios/wp9-confirmatory/d20181117-s10-r3.driver.json",
      "sha256": "3bccc344e1e7b93dc63edd42834bdff2fa2373a9811ad944d640e615936528df"
    },
    {
      "lengthBytes": 1324,
      "path": "benchmarks/scenarios/wp9-confirmatory/d20181117-s10-r3.veh4.driver.json",
      "sha256": "224d404cb43f8a1f89c905f3d78ef970102932bccaff9093104ef8119cab40fc"
    },
    {
      "lengthBytes": 1287,
      "path": "benchmarks/scenarios/wp9-confirmatory/d20181117-s10-r4.driver.json",
      "sha256": "47f930c9209d79f64e23c23418320d67da5a1c2be64ab102ec5799749e535143"
    },
    {
      "lengthBytes": 1324,
      "path": "benchmarks/scenarios/wp9-confirmatory/d20181117-s10-r4.veh4.driver.json",
      "sha256": "bd49b5fd40b1368e95adc882a65cd25df3c34ff313269c9548e2986372c63cba"
    },
    {
      "lengthBytes": 1287,
      "path": "benchmarks/scenarios/wp9-confirmatory/d20181118-s10-r1.driver.json",
      "sha256": "7a4f913ec84508632db404d4eacf1ee29a9a6db1f13e0e7498b17d924c58c6e1"
    },
    {
      "lengthBytes": 1324,
      "path": "benchmarks/scenarios/wp9-confirmatory/d20181118-s10-r1.veh4.driver.json",
      "sha256": "3659ba7279f89598ea820db7a77ced0b50338f6e9e527e46514543fe9d26a2c7"
    },
    {
      "lengthBytes": 1287,
      "path": "benchmarks/scenarios/wp9-confirmatory/d20181118-s10-r2.driver.json",